{
  "schema_version": "1.0.0",
  "id": "id-example-0001",
  "kind": "document",
  "uri": "https://example.org/artifact",
  "digest": "sha256:aaaaaaaaaaaaaaaaaaaaaaaaaaaaaaaaaaaaaaaaaaaaaaaaaaaaaaaaaaaaaaaa",
  "classification": "public",
  "created_at": "2026-07-26T12:00:00Z",
  "source_system": "source_system-example-0001"
}
